{"schema_version": "v2", "seq": 47, "t_wall": 1770225633.946386, "aircraft": "FA-18C_hornet", "bios": {"_ACFT_NAME": "FA-18C_hornet", "IFEI_RPM_R": " 64", "CLIP_APU_ACC_LT": 0, "CLIP_BATT_SW_LT": 0, "CLIP_FCES_LT": 0, "CLIP_FCS_HOT_LT": 0, "CLIP_FUEL_LO_LT": 0, "CLIP_GEN_TIE_LT": 0, "CLIP_SPARE_CTN1_LT": 0, "CLIP_SPARE_CTN2_LT": 0, "IFEI_CLOCK_S": "03", "IFEI_TEMP_L": "323", "CLIP_L_GEN_LT": 0, "CLIP_R_GEN_LT": 0, "CLIP_SPARE_CTN3_LT": 0, "INT_WNG_TANK_SW": 0, "LEFT_DDI_CRS_SW": 1, "LEFT_DDI_HDG_SW": 1, "IFEI_TEMP_R": "296", "FIRE_TEST_SW": 1, "EXT_PWR_SW": 1, "GND_PWR_1_SW": 1, "GND_PWR_2_SW": 1, "IFEI_CODES": "   ", "STROBE_SW": 2, "PROBE_SW": 1, "GND_PWR_3_SW": 1, "GND_PWR_4_SW": 1, "IFEI_SP": "   ", "FCS_RESET_BTN": 0, "GAIN_SWITCH_COVER": 0, "TO_TRIM_BTN": 0, "EXT_CNT_TANK_SW": 1, "EXT_WNG_TANK_SW": 1, "FUEL_DUMP_SW": 0, "IFEI_TIME_SET_MODE": "      ", "COM_COMM_G_XMT_SW": 1, "COM_COMM_RELAY_SW": 1, "COM_IFF_MASTER_SW": 0, "COM_IFF_MODE4_SW": 1, "GAIN_SWITCH": 0, "IFEI_RPM_TEXTURE": "1", "COMM1_ANT_SELECT_SW": 1, "IFF_ANT_SELECT_SW": 1, "IFEI_FF_TEXTURE": "1", "OBOGS_SW": 1, "HYD_ISOLATE_OVERRIDE_SW": 0, "MC_SW": 1, "COM_CRYPTO_SW": 1, "COM_ILS_CHANNEL_SW": 0, "COM_ILS_UFC_MAN_SW": 1, "IFEI_TEMP_TEXTURE": "1", "APU_CONTROL_SW": 0, "APU_READY_LT": 0, "ENGINE_CRANK_SW": 1, "CMSD_DISPENSE_BTN": 0, "GEN_TIE_COVER": 0, "GEN_TIE_SW": 0, "IFEI_NOZ_TEXTURE": "1", "CB_FCS_CHAN1": 0, "BATTERY_SW": 2, "L_GEN_SW": 1, "R_GEN_SW": 1, "BLEED_AIR_PULL": 0, "IFEI_OIL_TEXTURE": "1", "CB_FCS_CHAN2": 0, "CB_LAUNCH_BAR": 0, "CB_SPD_BRK": 0, "BLEED_AIR_KNOB": 2, "CABIN_PRESS_SW": 2, "ECS_MODE_SW": 2, "ENG_ANTIICE_SW": 1, "IFEI_BINGO_TEXTURE": "1", "PITOT_HEAT_SW": 0, "IFEI_LSCALE_TEXTURE": "1", "COCKKPIT_LIGHT_MODE_SW": 0, "LIGHTS_TEST_SW": 0, "FLIR_SW": 1, "LST_NFLR_SW": 0, "LTD_R_SW": 0, "IFEI_RSCALE_TEXTURE": "1", "KY58_MODE_SELECT": 0, "INS_SW": 4, "RADAR_SW": 2, "RADAR_SW_PULL": 0, "WSHIELD_ANTI_ICE_SW": 1, "IFEI_L0_TEXTURE": "1", "KY58_FILL_SELECT": 0, "KY58_POWER_SELECT": 0, "CB_FCS_CHAN3": 0, "EJECTION_HANDLE_SW": 0, "EJECTION_SEAT_ARMED": 0, "IFEI_R0_TEXTURE": "1", "CANOPY_SW": 1, "CB_FCS_CHAN4": 0, "CB_HOOOK": 0, "CB_LG": 0, "FCS_BIT_SW": 0, "EJECTION_SEAT_MNL_OVRD": 0, "HIDE_STICK_TOGGLE": 0, "SEAT_HEIGHT_SW": 1, "SHLDR_HARNESS_SW": 0, "IFEI_L50_TEXTURE": "1", "LEFT_VIDEO_BIT": 0, "NUC_WPN_SW": 0, "RIGHT_VIDEO_BIT": 0, "IFEI_R50_TEXTURE": "1", "STICK_GUN_TRIGGER2": 0, "STICK_N_WHEEL_SW": 0, "STICK_PADDLE_SW": 0, "STICK_RECCE_SW": 0, "STICK_WEAP_REL_BTN": 0, "THROTTLE_CAGE_BTN": 0, "THROTTLE_DISP_SW": 1, "CMSD_JET_SEL_L": 0, "IFEI_L100_TEXTURE": "1", "EMERG_INSTR_INT_LT": 0, "ENG_INSTR_INT_LT": 0, "THROTTLE_ATC_SW": 0, "THROTTLE_EXT_L_SW": 1, "THROTTLE_FOV_SEL_SW": 0, "THROTTLE_SPEED_BRK": 1, "EXT_POSITION_LIGHT_LEFT": 0, "EXT_POSITION_LIGHT_RIGHT": 0, "EXT_REFUEL_PROBE_LIGHT": 0, "EXT_STROBE_LIGHTS": 0, "EXT_TAIL_LIGHT": 0, "EXT_WOW_NOSE": 1, "EXT_WOW_RIGHT": 1, "IFEI_R100_TEXTURE": "1", "SAI_ATT_WARN_FLAG_L": 1, "EXT_WOW_LEFT": 1, "IFEI_LPOINTER_TEXTURE": "1", "KY58_FILL_SEL_PULL": 0, "IFEI_RPOINTER_TEXTURE": "1", "IFEI_Z_TEXTURE": "0", "AMPCD_BRT_CTL": 65535, "IFEI": 45874, "SAI_SET": 32767, "SAI_PITCH": 32618, "SAI_BANK": 32765, "SAI_ATT_WARNING_FLAG": 0, "SAI_MAN_PITCH_ADJ": 32767, "SAI_SLIP_BALL": 32794, "SAI_RATE_OF_TURN": 32772, "STBY_ASI_AIRSPEED": 0, "STBY_PRESS_ALT": 0, "STBY_ALT_100_FT_PTR": 3167, "STBY_ALT_10000_FT_CNT": 0, "STBY_ALT_1000_FT_CNT": 316, "STBY_PRESS_SET_0": 13986, "STBY_PRESS_SET_1": 58981, "VSI": 32767, "STBY_PRESS_SET_2": 39321, "LEFT_LOUVER": 0, "RIGHT_LOUVER": 0, "HYD_IND_BRAKE": 45455, "RWR_DMR_CTRL": 52428, "RWR_RWR_INTESITY": 65535, "CLOCK_HOURS": 0, "CLOCK_MINUTES": 0, "CLOCK_ELAPSED_MINUTES": 0, "CLOCK_ELAPSED_SECONDS": 0, "PRESSURE_ALT": 0, "RADALT_HEIGHT": 48495, "RADALT_MIN_HEIGHT_PTR": 37431, "RADALT_ALT_PTR": 3440, "RADALT_OFF_FLAG": 0, "HYD_IND_RIGHT": 39051, "HYD_IND_LEFT": 39057, "THROTTLE_FRICTION": 0, "POSITION_DIMMER": 0, "FORMATION_DIMMER": 0, "RUD_TRIM": 32767, "COM_VOX": 65535, "COM_ICS": 65535, "COM_RWR": 65535, "COM_WPN": 65535, "COM_MIDS_A": 65535, "COM_MIDS_B": 65535, "COM_TACAN": 0, "COM_AUX": 65535, "OXY_FLOW": 65535, "VOLT_U": 50403, "CABIN_TEMP": 18743, "VOLT_E": 50403, "SUIT_TEMP": 18743, "CONSOLES_DIMMER": 0, "INST_PNL_DIMMER": 0, "FLOOD_DIMMER": 0, "CHART_DIMMER": 0, "WARN_CAUTION_DIMMER": 49151, "KY58_VOLUME": 65535, "DEFOG_HANDLE": 50473, "CANOPY_POS": 0, "RWR_AUDIO_CTRL": 0, "THROTTLE_RADAR_ELEV": 32767, "CONSOLE_INT_LT": 0, "FLOOD_INT_LT": 0, "NVG_FLOOD_INT_LT": 0}, "delta": {"FLOOD_INT_LT": 0, "NVG_FLOOD_INT_LT": 0}}
